{"SchemaVersion":"amd-graphics-publication-validation/1.3","ToolkitVersion":"1.0.0","GeneratedAtUtc":"2026-08-12T17:54:49.6557172Z","Status":"Pass","ErrorCount":0,"Errors":[],"PrivacyStatus":"Pass","PrivacyErrorCount":0,"DatasetConsistencyStatus":"Pass","DatasetConsistencyErrorCount":0,"JsonWhitespaceStatus":"Pass","JsonWhitespaceErrorCount":0,"JsonFileCount":33,"MarkdownFormatStatus":"Pass","MarkdownFormatErrorCount":0,"MarkdownFileCount":27,"JsonDecodedScalarValidation":true,"Policy":"public/** is the only generated repository-publication surface; JSON privacy checks inspect decoded scalar values; canonical public JSON must already be compact before publication; public Markdown must be UTF-8 no-BOM with LF line endings."}
